,review,label
5118,Okurken zeze nin yaşadiklarina kah güldüm kah üzüldüm. Çok güzel bir kitap mutlaka okuyup kitaplığınızda çocuklarınız için bulundurmalisiniz.,2
5119,Bu kitapla başlamak insana ümit veriyor çünkü içimizdeki çocuk yaşadıkça yaşama tutunabiliyoruz bu kitabi okuyan kişi bu kitabın devamını okumak için sabırsız olamakta ve serinin tüm kitaplarını okuyacaktir,2
5120,İnsanlığa YABANCI birinin kısa cümleleri ve akıcı anlatımıyla yazdığı mükemmel bir eseri. Muhtemelen ikinci defa elinize almadan bitirirsiniz.,2
5121,"Gerçekten sürükleyici, bir çırpıda okunan etkileyici bir bilim kurgu romanıydı. Okuduğum ilk distopya türündeki romandı, severek okudum ve bilimkurgu klasikleri serisine devam etmeye karar verdim. Bence kitap okuma alışkanlığınız yoksa bunu kazanmak için ya da ütopya, distopya tarzı kitaplara başlamak için çok güzel bir kitap.",2
5122,Insanlik tarihini cok iyi anlatmış. Güzel kitap,2
5123,son zamanlarda en çok beğendiğim kitaplardan biri. müthiş bir anlatımı var,2
5124,siyah beyaz çatışmasını ve zaiyatlarini gündelik hayatın içinde muhteşem anlatmış ..,2
5125,trend e ayak uydurarak aldıgım herkesin anlattıgı ama anlam veremedeğim okumak icin aldıgım eser,2
5126,"Tek kelime ile muhtesemdi. korkunun insan üstündeki baskısı muhtesem anlatılmıştı.
mutlaka okunmalı .",2
5127,İlber Ortaylı yazsa da okusak dediğimiz kitaplardan biriydi. Her Türk genci bu kitabı okumalı.,2
5128,hediye aldım bir arkadaşıma güzel bir geri dönüşüm alırsam bende kendim için alıcam,2
5129,Faşizmin insan hayatını ve haklarını hiçe sayarak nasıl kötü sonuçlar doğurabildiğini ve önyargılar sonucu insanların birbirine mesafeli olmasının ne kadar anlamsız olduğunu anlatan sürükleyici bir kitap. Ayrıca bir çocuğun dilinden yazıldığı için saflığın aslında doğru olan olduğunu ispatlamış yazar bu kitabıyla.,2
5130,Yazarı beğenirim ancak bu romanı kendisinin diğer romanlarına nazaran beğenmediğimi söyleyebilirim. Benim zevkime hitap etmediğinden kaynaklanıyor bu da. Romantik kitapları sevenlere mutlaka tavsiye ederim.,2
5131,Harika etkileyici bir kitap kesinlikle okumalısınız öyle eften püften bir hikaye değil. Okuduktan sonra kitapta anlatılan olayları araştırmaya başlayıp karakterleri daha da iyi anlayacaksınız.,2
5132,değişik bir kitap okunması gerek,2
5133,Yazarın okuduğum ilk kitabı. Hikaye örgüsü ve anlatımı muhteşem. Muhakkak okunmalı.,2
5134,Camus'un yabancısı için ne denir ki? Gerçekten olağanüstüydü.. Okumadıysanız mutlaka edinin. Kitaptan sonra hayatta gördüğünüz her şey daha parlak gelecek. Hem felsefi hem de edebi bakımdan kısa bir metin olmasına rağmen çok etkileyici ve ilham verici.,2
5135,"george orwellin eserlerinin okunması ve anlaşılması gerekir günümüz manipüle edilen insanlara atfediliyır bence.
hocamın tavsiyesi üzerine zevkle okuduğum bi kitap gerçekten olay kurgusu mükemmel, bence günümüz hayati anlatıyor zengin fakir iyi kötü...bilinçsiz toplumlar bilinçsiz bi şekilde yönetilir kim tarafından yönetildiği belli değil biri gelir biri gider ...",2
5136,Beğenerek okuduğum ve çok sevdiğim bir kitap oldu. Kesinlikle herkes okumalı diye düşünüyorum.,2
5137,Daha ilk satırlarıyla olduğum yere kilitlendim. İz bırakan bir kitap.,2
5138,Her yaşa hitap eden bir eser. Mutlaka okunması gereken kitaplardan.,2
5139,Küçük bir toprak satın alıp insanca bir hayat yaşamanın hayalini kuran bu ikilinin öyküsünde dostluk ve dayanışma duygusu önemli bir yer tutar. Steinbeck insanın insanla ilişkisini anlatmakla kalmaz insanın doğayla ve toplumla kurduğu ilişkileri de konu eder bu destansı romanında.,2
5140,Kitap çok güzelde boyu niye cep boy gibi yapmislar hic iyi olmamis,2
5141,68 sayfa bir kitap en fazla ne kadar etkileyebilir diyorsanız bu kitabı tavsiye ederim . okuduktan sonra uzun bir süre etkisinde kalıyorsunuz . anlatımı çok güzel sıkmıyor.,2
5142,Okuduğum en güzel romanlardan...,2
5143,Harikaydı. Zaten Camus'un anlatımını çok severim. Yabancı'da ayrı bir keyif verdi.,2
5144,Güzel bir eser.Kısa ve akıcı bir anlatımı var.,2
5145,cengiz aytmatov un her eseri kesinlikle okunmalı.öncelikle türk dünyasından çıkan evrensel bir yazar olması bile onu okunmaya değer kılıyor.kitapları da çok akıcı ve sade,2
5146,edebiyatımızın nadide yazarlarından sabahattin Ali. gerçekten kalıteli bir eser.,2
5147,"hayvanlar kullanılarak, komünizme karşı eleştirel bakış açısı ile yazılmış bir roman. Akıcı bir üslubu var. Lakin bazı yerlerinde sanki tekrar ediyormuşçasına kalıplaşmış ifadeler var bu yüzden kitabı okurken atlayarak okudum. Hayvanlar üzerinde kurgulanan analizler mükemmel olmuş. Basit ve herkesin anlayabileceği bir roman.",2
5148,bir solukta okunabilecek bir kitap. vermek istediği mesaj son ana kadar gizli tutuluyor aslında sonu şaşırtıcı.,2
5149,Kitabın aksiyonu hiç düşmüyor zaten Türkiye gibi az okuyan bi toplumda bi kitap 77.baskısını yapıyorsa o gerçek bi klasiktir,2
5150,"Kitap insanın toplum kuralları tarafından baskılanan, içinde saklı kalmış yanı üzerinden geçiyor. Kitap karakteri kendisini keşfederken bir yandan okurun içinde de bir şeyleri aydınlatıp ortaya çıkarıyor.",2
5151,livanleli yine muhtesemligini konuşturmuş,2
5152,Büyük küçük herkesin okuması gereken bir kitap. Bazı sayfalarda insan ister istemez kendini sorguluyor.,2
5153,farklı açıdan bakmak isteyenler için güzel bir eser,2
5154,DAHA ÖNCE BU KİTABI OKUDUM. TASİYE EDERİM SÜPER BİR KİTAP,2
5155,Tek kelime ile bir baş yapıt olaylar insanlar kurgu dil akıcı ve sade en iyi kitabı bence herşey var kitapta tarih coğrafya psikoloji bilim ve sanat,2
5156,"tamamen merakımdan aldım, tek solukta okudum",2
5157,KESİNLİKLE HER YAS GRUBUNUN OKUYUP BEĞENEBİLECEĞİ VE HERKESİN BİRSEYLER CIKARABİLECEĞİ BİR KİTAP,2
5158,HEDİYE ALMIŞTIM.BİLİMKURGU YAPISI GÜÇLÜ,2
5159,"Çoğu kisiden duydugum, merakla okumak istedigim kitap",2
5160,çok güzel bir kitap herkese tavsiye ederim . herkes okumalı derim.,2
5161,aşırı duygulandırcı bir kitap öneririm.,2
5162,Okurken beni çok etkilemiş olan kitabın içindeymişim gibi sanki bir karakter benmişim gibi içine alan inanılmaz bir kitap. Okuyun etrafınızda okumamış arkadaşlarınıza hediye edin kitap okuma alışkanlığı olmayan kişilere özellikle hediye edinki alışkanlık kazansınlar kitap okumaya başlıycaklarından eminim.,2
5163,"bir çok odası olan bir köşk, halkın düşünmesine, konuşmasına, izin vermeden ellerindeki her şeyi alan yöneticiler.... Cok tanidik geldi dimi",2
5164,"Kitap çeviri olduğundan sanırım verilen örnekler ve üslup batıya yönelik tarzda. Anlatılmak istenilenler daha öz bir biçimde tasvir edilebilirdi. Yine de okunmaya değer, unuttuğumuz bazı değerleri hatırlatan bir eser olmuş.",2
5165,Inanilmaz surukleyici bir kitap mutlaka okunmalıdır diye düşünüyorum.,2
5166,Mutlaka okunması gereken kitaplardan. Zeze(5)'nin hayatı sizleri derinden etkileyecektir.,2
5167,bir insanın bir şehre karşı dik duruşunu çoğunluktan korkmamasını anlatıyor.Eşitsizliği ve ırkçılığın açtığı yaraları kolayca hissedebileCeğiniz bir kitap,2
5168,filmini izlemiştim ama keşke ilk olarak kitabını okumuş olsaydım,2
5169,"Stefan Zweig'ın, 1942 yılında, Hitler iktidarından kaçarak sürgün hayatı yaşadığı Buenos Aires'te yayımladığı Satranç adlı romanı, hem yazarın intiharından önce bıraktığı bir veda mektubu hem de doğrudan Nazizm'i hedef aldığı tek kurmaca eseridir. New York'tan Buenos Aires'e yapılan bir gemi yolculuğunda, dünya satranç şampiyonu Mirko Czentovic, kendisi için beklenmedik bir rakip olan Dr. B. ile karşılaşır. İsimsiz bir amatör olan bu gizemli rakibin satrançla tanışmasının olağanüstü bir hikâyesi vardır. Bir Nazi kurbanı olan Dr. B., o kara günlerde sadece satranç sayesinde ayakta kalabilmiştir.
Hikâyenin diğer kahramanı Czentovic ise iletişim kurmakta zorlanan, yaşamında satranç dışında hiçbir şey olmayan, kazanmaya kurulu bir saat, soğuk, küstah, kuralcı, yüzeysel, kültürsüz, karacahil bir ""dahi""dir. Bu kısa anlatıda, Zweig'ın tüm izleklerini bulmak mümkün.",2
5170,muhteşem bir disütopya..herkesin mutlaka okuması gerek..,2
5171,arkadaşımın tavsiyesiyle aldım dili biraz ağır geldi ve ilk başlarda biraz sıkıldım fakat sonra aşırı sevdiğim bir kitap oldu,2
5172,Otelin erken yılbaşı kutlamasına davetli kişiler ve çalışanların hayatlarını genel olarak konu alan bir kitap.Bazı kişileri öyle anlatmış ki azıcık googleda araştırmayla kimlerin olduğu anlaşılıyor.Bazı olayların hayretle gerçek olduğunu öğrendim.İyi bir araştırmayla yazılmış kurgusuna hayran kaldığım bir kitap oldu.,2
5173,elinize alınca huzur bulacağınız bir kitap. herkes okumalı.,2
5174,bir kaç videosunu izlediğim yazarın kitabını da okumak istedim cok etkileyici bir kitap,2
5175,"dolu dolu bir kitap istabul masalları çok güzel kurgu ile birleştirimiş ,
zevk alarak okunuyor . tavsiye ederim .son sayfaya kadar sürüklüyor yazar .",2
5176,Muhteşem ötesi bir kitap .Sanki günümüzü anlatmak için yıllar öncesinden uyarı niteliğinde yazılmış gb .okuyun hiç düşünmeden beklemeden hemen okuyup görün bir utopya nin nasıl gerçek olduğunu,2
5177,Polisiye dalında güzel bir kitap. Konu oldukça ilginç ve akıcı işlenmiş. Benim için Tek eksi yanı kahramanların psikolojik anlatımlarına az yer verilmiş,2
5178,Elinizden bırakmayacağınız harika macera kitabı. Müthiş bir roman . gerilim merak ne ararsanız. Macera severlerin bir solukta okuyacağından eminim. Aklından bir sayı tut. Aldıklarını vereceksin. Verdiklerni aldığın zaman bay 658,2
5179,Güzel ve düşündüren bir kitap,2
5180,bu kitabı okurken çocukluğuma döndüm ve unuttuğum anıları hatırladım,2
5181,Keyifle okuduğum bir kitap. Okumamış olanlara şiddetle tavsiye ederim. Konu ve kurgusu harika.,2
5182,kitap okuyorum diyen herkesin okuması gereken kitap.,2
5183,Puanlarımla aldığım kısacık fakat muhteviyatı geniş bir kitap,2
5184,"çok akıllıca kurgulanmış,ince düşünülmüş bir kitap . Bir solukta okuduğum ve sürekli heyecanla sonunu düşündüğüm bir eser",2
5185,Sabahattin Ali'nin romanlarındaki kahramanlarının iç konuşmalarına yer verdiği psikolojik süreçleri aktarış halini çok seviyorum. Bu romanında da bu iç sesleri ve psikolojik tahlilleri çokça bulunuyor. Bu yüzden benim için roman daha da değerli. Stefan Zweig'e benzetiyorum bu açıdan. Onu okuduğumda da benzer bir keyif alıyorum.,2
5186,Pek akıcı olmasa da güzel bir kitap,2
5187,İlk Livaneli kitabımdı. Hala unutulmazlarım arasında.,2
5188,Mükemmel bir kitap. Çok ağır bir hikayesi var. Ancak bu hikayeler maalesef ki dünyamızda yaşanıyor. Gerçekten harikaydı.,2
5189,"Yazar 70'li yıllardan itibaren yanılmıyorsam 2012' ye kadar İstanbul'un siyasi, ekonomik ve toplumsal değişimini Konya Beyşehir'li mevlüt üzerinden oldukça detaylı bir şekilde anlatıyor. Köşeyi dönenler, dönemeyenler, hemşehricilik, sağ-sol çekişmesi, insanlar arası ilişkiler ana karakter mevlüt etrafında detayları ile işlenmiş.",2
5190,Bu kadar kısa bir kitapta nasıl o duygular o kadar detaylı anlatılmış gerçekten inanamadım. Bir insanı öldürdüğü için değil aslında duyguları tavırları topluma aykırı olduğu için suçlanan topluma yabancı bir insanı anlatıyor. Kesinlikle okunmalı.İlginç bir kitap.,2
5191,ÖZÜNÜ ARAYIŞIN SERÜVENİ..,2
5192,Bir öneriyle okudum ve bütün bakış açım değişti. Yazarın bahsettiği dönem gelmemiş olabilir fakat yakın gelecek gibi gözüküyor.,2
5193,Efsane bir kitap 60. sayfadan sonra başlasada.,2
5194,Yalnızca çocuğa yönelik olmayan güzel bir kitap.,2
5195,böyle güzel bir masal çok sık bulunmaz. bitmesini istemedim okurken. kesinlikle tavsiye ediyorum,2
5196,"Herkesin okuması gereken, ders çıkarabileceğimiz bir kitap.",2
5197,"İçimizdeki şeytan pek de kurnazca olmayan bir kaçamak yolu.. İçimizde şeytan yok.. İçimizde aciz var.. Tembellik var.. İradedesizlik, bilgisizlik ve bunların hepsinden daha korkunç bir şey: hakikatleri görmekten kaçmak itiyadı var..",2
5198,Kafka'ya ilgi duymamı sağlayan kitap.,2
5199,Kitabı okurken günümüz oluşumlarını daha iyi anlayacaksınız.,2
5200,yatmadan önce 1 saatte okunabilecek okunmaya değer bir hikaye,2
5201,Bir ülke nasıl hep beraber kalkınıra en iyi örnek.çok güzel bir kitap,2
5202,Çok beğendiğim bi kitap ben de ayrı bi yeri var bu kitabın tevafuken Urfa Balıklıgöl de karşılaştık ve imzalattigim kitap.,2
5203,yazarın okuduğum ilk kitabı.herkesin okuması gerekiyor,2
5204,Herkesin okuyamayacağı okusa da anlayamayacağı bir kitap. Anlamak için Oğuz Atay kişiliğine bürünmeniz gerekir. Bir parça Atay'lık varsa sizde de bu kitabı çok kez okuyabilirsiniz.Ben üç kez okudum ve ara ara açar sayfalara göz gezdiririm. Her açtığım sayfada hayatın başka bir bölümü hakkında tespitler bulurum. Türk edebiyatının en zengin eseri bana göre bu kitap.,2
5205,Dünya edebiyatının kült eserlerinden defalarca okunabilecek eser.,2
5206,Yazarın ismini kapatıp kitabı bana okutsanız bu kitabı Zweig yazmış derim. İlgi çekici konusuyla klasik Zweig diliyle gercekten güzel bir kitap.,2
5207,boşuna klasikler arasına girmemiş. zevkle okudum. tavsiye ederim.,2
5208,"Hızl ıgitmesede , Oguz Atay klasiği bir baş yapıt. Kalınlığından çekinmeden okunması gereken bir kitap.",2
5209,Fiyatının bu kadar uygun olması çok güzel,2
5210,Kesinlikle sürükleyici bir kitap. Şiddetle tavsiye ederim.,2
5211,Farklı bir tarzda yazılmış bir kitap. Beğenerek okudum. Çok akıcı tavsiye ederim.,2
5212,12 YAŞINDAKİ KIZIMA ALDIM. 2 GÜNDE BİTİRDİ. KİPTABI ÇOK SEVDİ.,2
5213,kitap elime en kısa sürede ulaştı teşekkür ederim kitapyurdu.okur okumaz hemen yorumu yapacağım,2
5214,bır bas ucu kıtabı yatmadan once tavsıye edılır,2
5215,Sabahattin Ali'nin bu eseri çağlar üstü bir eser. Yıllar geçse de bu öyle olacak. Hayatınızda iz bırakabilecek bir kitap.,2
5216,ne yazsam nereden başlasam da beni derinden etkileyen bu müthiş eser hakkında bir kaç satır yazsam. okuyun ve etrafınızdaki kitap seven herkese okutun. son yıllar da okuduğum okumakta neden bu kadar geç kaldım diye düşündüğüm güzel eser.,2
5217,Baştaki uzun betimlemerden sıkılsam da son derece sürükleyici okunası bir kitap. Bir kaç günde bitireceğiniz ama gördüğünüz her pilav satıcısında aklınıza gelecek bir eser. Tavsiye ediyorum.,2
5218,Herzaman ki gibi muhteşem bir elif Şafak,2
5219,"yalnızca fiziği değil; hem fiziği çocuk olanlar, hem de ruhu çocuk kalanlar için bir kitap. Her okuduğumda harika noktalar görüyorum",2
5220,Stefan Zweig'in en sevdiğim eserleri arasında yer alıyor zaten çok kısa bir kitap bir solukta okunabilir.,2
5221,"Benim gibi böyle pembeli çiçekli böcekli şeyler sevmeyen okurlar, uyarıyorum, kitap kapağı tasarımına kanmayın. Zira içeriği aşktan ziyade mantıkla doludur. Birbirlerine imkansızlıklar içinde değil de imkanlar dahilinde aşık olanların hikayesidir. Etkileyici, akıcı ve üzücüdür. Umut kıvılcımlarını alevlenmeden söndürür.",2
5222,Bir yetişkinin okuması ve çocuğuna okutacağı ilk kitap olmasını dilerim. Yiten değerleri hatırlatan eşşiz bir eser.,2
5223,Muhteşem bir kitap her kitap severin rafında olmalı bence. Tavsiye ederim,2
5224,Okurken odaklanmak gerek aksi halde örgüde ve karakterlerde karmaşa yaşanabilir.Konu sürekli birilerinin ağzından anlatılıyor.,2
5225,"Fikirlerinize değer katacak bir kitap,kesinlikle okunmalı!!!",2
5226,Etkileyici bir eser. Okumak lazım.,2
5227,"Daha önce okumayı isterdim biraz geç kaldım. Yeni okuyorum akıcı, güzel bir kitap.",2
5228,Serinin son kitabı da güzel.,2
5229,"Büyüklere masal değil, ders gibi. Bir çırpıda okunabilecek bir eser.",2
5230,bir çok duyguyu bir arada görebileceğiniz hoş bir kitap.,2
5231,Kürk Mantolu Madonna yı okuyalı bir hayli olmasına rağmen sanırım her sayfasını tek tek hatırlayabiliyorum.,2
5232,"Kaç yaşına gelirsem geleyim, kaçıncı kez okursam okuyayım verdiği tad hiç değişmeyecek olan, en sevdiğim kitaplardan Küçük Prens! Her yaşımın kitabı...",2
5233,Kürk Mantolu Madonna'sını överler hep. Aslında şaheseri bu olmalı..,2
5234,Tarzı farklı yazarlardan mutlaka okunmalı,2
5235,"farklı iki ınsan tarafından görülen iki farklı rüya ve hayallerinin peşinden giden genç bir delikanlı.. uzun yolculuklar da başına gelen olaylar... aşk , eşkiya ve kendi makalesini yazmak cabası sonucunda ulaşılan başarı... mutlaka okumalısınız....",2
5236,hiç bitmesin istedim bitince üzüldüm.,2
5237,okuduğum en iyi kitaplardan biri .. ilk sayfalar biraz sıksa da kesinlikle okumayı bırakmadığım için mutluyum .,2
5238,Güzel eser güzel fiyat okunabilir,2
5239,Güzel bir kitap. Felsefeye yeni başlayacaklar için tavsiye ederim.,2
5240,"Dünya edebiyatının en büyük ve en kült eserlerinden birisi. Çağlar boyunca eskimeyecek, güncelliğini yitirmeyecek bir başyapıt.",2
5241,günümüzde iktidara geçmeden ve iktidara geçtikten sonra liderlerin hırsları ve ideallerin hırsları yüzünden nasıl yok olup birer sömürgeci ve mutlakiyetçi oduklarını özetleyen bir eser.,2
5242,"Her yaşta, defalarca okunabilecek bir eser",2
5243,"Yazar metafor üzerinden aslında toplumdaki farklı olanı dışlama, önemsememe, hoşgörmeme hallerini de dile getirmiş.",2
5244,Annelere yol gösterici nitelikte çok sevdik biz kitabı eğitici öğretici düşündürücü ve üzerine yorum yapılabilecek güzel oyunlar var içersinde,2
5245,Zweig'ın öyküleri bir harika.,2
5246,gerçekten etkileyici bir hikaye,2
5247,"Sıradan fikirleri barındıran bir kitap değildi, çok etkilendim,akıcı, farklı bir kitap.Her kitapseverin okuması gereken bir kitap",2
5248,"Her yaşa uygun, mükemmel bir kitap.",2
5249,İlber Hoca uçmuş resmen Fransız kaldım bazı bilgilere. İslam öncesi tarih çok az çünkü İlber Hoca belirtiyor kaynaklar diye. Çok önemli bilgiler içeriyor. Dili de çok iyi hocamızın. Akademik kitap okumadıysanız ağır gelebilir,2
5250,Çok sürükleyici farklı anlatımı ile harika..,2
5251,Kitabi okurken gercekten o hayati yasiyorsunuz. Özellikle yazar yasatmak istedigi duygulari kesinlikle yasatiyor. Karakterler donemle birlikte basarili bir sekilde anlatiliyor.,2
5252,Elinize aldığınız gibi bitireceğiniz eşsiz bir kitap,2
5253,Sonunda çok duygulandım açıkcası :(( beni çok saran bir kitap oldu,2
5254,Yazarla barışmak için aldığım ve barıştığım kitabı.,2
5255,İlber Ortaylı tarzında bir kitap. Sanki Atatürk özelinde yazılmış bir kitap değil. Birinci Dünya Savaşından itibaren Avrupa ve Türkiyedeki genel durumu anlatmış.,2
5256,"Atatürke ilham kaynağı olduğunu göz önünde bulundurunca ""din adamları"" kısmında Atamızın nasıl bir din anlayışına sahip olduğunu bir kez daha anladım ve minnettar oldum. Yaşa!",2
5257,Hocamin tavsiyesi üzerine okumuştum. Kesinlikle bende tavsiye ediyorum,2
5258,"İnsanlığa yabancılaşmış, ihtiyaçlarına olsa da olur olmasa da olur gözü ile bakan bir adamın bakış açısı ile yazılmış farklı bir kitap. Okuyun okutun.",2
5259,Yazarın birçok kitabını okudum.Bu kitapta da yine efsane anlatımı var.,2
5260,bir ülke nasıl ayaga kalkar en guzel anlatımı,2
5261,Sanki karakterleri kendim yaşıyordum kitapta.,2
5262,İlk kitaptan sonra güzel bir köprü olmuş bu kitap.Olaylar güzel bir şekilde birbirine bağlanmış.Gayet güzeldi.,2
5263,Ankara MÜzesi'ne gidin. Kitap içeriğine yaklaşırsınız. Faydalı bir kitap.,2
5264,ilber Hocayla sohbet etme hissini tadacaksınız.,2
5265,"Başyapıt ve başucu kitabı. Tekrar tekrar okunası, fevkalade bir kitap.",2
5266,kitap okumaya yeni başlayanların tercihi,2
5267,"Roman olarak yazıldığı unutulmadan okunmalı, güzel ve akıcı bir eser...",2
5268,1984'ten sonra okunduunda daha farklı bir tat verdiğine inanıyorum.,2
5269,"Çok görmüs, gezmis, yasamis hir insanin hayat tecrübelerinden faydalanmak adina çok güzel bir kitap olmus. Tabi icinde katilmadigim noktalar da çokça mevcut, çünkü her insan esit sartlar altinda yeterli imkanlarla dogmayabiliyor.",2
5270,"hikayelerine bayıldım, anlatımı sade...",2
5271,Cok güzel bir kitap. Yalnızlığın insana neler yapabileceğini cok iyi anlatılıyor.,2
5272,kısa sürede bitirebileceğiniz bir kitap,2
5273,canevimden vuran cümleler bitmek bilmedi kitapta. o kadar etkilendim ki kendime gelmeye çalışıyorum.,2
5274,Her zamanki gibi cok içten bir anlatım ve içerik. Teşekkürler,2
5275,Zeze merhametli yüreği kocaman bir çocuk! 2 saatte bitti muhteşemdi.,2
5276,"Çevresindeki insanların sahtekarlıklarından yorgun düşmüş Holden'da insanın kendisini görmemesi elde değil. Ve Salinger bunu öyle güzel anlatmış ki, kitabı okurken Holden olup çıkıyorsunuz. Salinger, Holden'ın çevresindeki sahtekarlıklardan duyduğu rahatsızlığı anlatırken esprili bir dil de kullanmış. Ama yazarın da belirttiği gibi -ya da Holden'ın mı demeliyim- ''Okuduğunuz kitapta arada bir sizi güldürecek şeyler olmalı. Bir kitabı okuyup bitirdiğinizde, keşke yazar arkadaşım olsaydı da bazen onu arayıp konuşabilseydim, demelisiniz.''",2
5277,Sabahattin Ali okunması gereken yazar,2
5278,138'den sonrası çok akıcıydı.,2
5279,"İlk kez ortaokulda öğretmenimin ödev vermesi üzerine okumuştum. Sırf ödev diye okumaya başladığım kitabın, zamanla en sevdiğim kitap haline geleceğini düşünmemiştim o yaşta. Umarım herkes hangi yaşında olursa olsun bir şekilde okuma fırsatı yakalar bu kitabı.",2
5280,uzun görüp de okumamazlık yapmayın muhteşem bi kitap,2
5281,Kızıma almıştım ama ben ondan önce okudum sevdim farklı bir dünya aynı kaos,2
5282,Tek bir geceyi 80 sayfada nasıl anlatır diye düşünmüştüm ve iyi ki okumuşum.Zweing'den okuduğum üçüncü kitap ve betimlemeleri ve psikolojik tahlilleri Satranç kitabındaki gibi ön planda,2
5283,"Maria Puder o kadar güçlü ama bir o kadar da savunmasız bir çocuk gibi... Yazar olay örgüsünü mükemmel tamamlıyor. Unuttuğumuz duygular, sevgiler, aşklar hepsi bir kitap sayfasına bakıyor yeniden canlanmak için...",2
5284,"Kitap genel olarak bir aşk hikayesini konu alsa da Raif Efendi'nin kendi içinde yaşadıkları, insanlara bakış açısı beni gerçekten çok etkiledi.",2
5285,Kitabı okurken günümüzle bağdaştırıcağınız o kadar çok şey var ki,2
5286,okuması keyifli başka dünyalara götüren bir kitaptı.,2
5287,Zweig'ın kaleminden etkileyici bir eser daha kitaba kendinizi kaptırıp gidiyorsunuz.,2
5288,Kendini bir çırpıda okutan kitap. Tavsiye ederim.,2
5289,Söze gerek olduğunu düşünmediğim ve her kitaplığın baş romanı olması gereken bir kitap,2
5290,Gabriel Garcia Marquez'in okumuş olduğum ilk kitabıydı. Olacağını herkesin bildiği bir cinayetin ele alındığı Kırmızı Pazartesi adlı kitapta olay örgüsü iyi işlenmiş bence. Sonucunu başlangıçta bilmenize rağmen acaba olay nasıl olmuş diye merakınızı cezbediyor. Ben kitabı çok beğendim bir çırpıda bitti. Fakat bazen cümleler arasında zaman uyuşmazlığı olduğunu fark ettim çeviriden mi kaynaklandı bilmiyorum. Yine de alınıp okunulması gereken bir kitap tavsiye ederim.,2
5291,Hayat tesaduflerle doludur mu yoksa tesaduflere bırazda biz mi zemin hazırlıyoruz dedirten oldukça sürükleyici ve güzel bir Orhan Pamuk kitabı,2
5292,pskolojiye ilgisi olan okumalı.,2
5293,Fİ'yi bitirdiniz ve Çi'ye geçtiniz. İşte bu bile doğru yolda olduğunuzu gösterir. Çi'yi küçümsemeyin o da diğerleri kadar çok şey anlatıyor size. Farkındalık yaratmak değil mesele farkında olduğunu bilmek size göstermek.,2
5294,İçe bakışı yansıtan mükemmel bir roman,2
5295,Dili biraz ağır ama etkili bir kitap.,2
5296,mutlaka diğer kıtaplarınıda okumayı istedgim bir yazarın kıtabı.. işlenmemiş bir konuyu ele alması diğer romanlardan ayırt edıcı oldugunun kanıtı. okunmalı,2
5297,Kitabı bitirince hemen filmini izledim. Büyük hata tabii.,2
5298,bilim meraklılarına göre çok iyi bir kitap,2
5299,Youtube da denk gelmiştim birkaç kez videolarına. Kitabını görünce de mutlaka almalıyım dedim. Anlatımı oldukça güzel.,2
5300,İlber hoca ile karşılıklı sohbet ediyormuşcasına. Tavsiye ederim,2
5301,Yazarın en iyi kitaplarından biri! Bir insan bir duyguyu ancak bu kadar anlatabilirdi.,2
5302,George Orwell'ın yine harikalar yarattığı bir roman. Okunmalı.,2
5303,"Suriyelilere ve mültecilere bakışınızı değiştirecek, insani duygularınızı öne çıkaracak bir kitap. Okumanızı tavsiye ederim.",2
5304,Düşüncelerin bile yasak olduğu bir yer hayal edebiliyor musunuz!!! Bu kitapta birçok şeyin yasak olduğu tek tip insanların tek tip yaşam tarzının kendileri gibi olmayan ya da düşünmeyen insanların nasıl yargılandıklarının hikayesine tanık olacaksınız... Herkesin okuması gereken bir kitap.,2
5305,Okuduğum en güzel aşk kitaplarından biri. Başladığınızda bitirmeden bırakmayacağınız bir kitap,2
5306,Bu kitabı keşke 15 yaşında okusaydım demiştim. Okunası kitaplardan,2
