,review,label
1631,"Çokça abartılmış, hakkettiğinin çok üzerinde ilgi ve övgü almış bir yazar. Öldürülmesinde etkili olan fikrin(!) düşmanları tarafından pohpohlanmış ve kitapları bugün en çok satılanlarda. Kişilik bozukluğu hadsafhada olan yazar romanlarinda da bunu açıkça kanıtlıyor.Genel olarak kitap güzel kurgulanmış fakat istediği zevki verememiştir.",0
1632,Bu kadar olumlu yoruma aldanıp aldığım ve hayal kırıklığı yaşadığım bir kitap. İlk 60-70 sayfa iyi gidiyor ancak ondan sonra kitap beni sıkmaya başladı. Yazar pek çok mesaj vermek istemiş olabilir kitapta alan kişilerde olmuş bu mesajı fazlasıyla. Ama ben alamadım sanırım gereken mesajı:) Sağlık olsun.,0
1633,Dili ve konusu bana ağır gelmiş olup iran edebiyatına da ilgim olmadığını anladım,0
1634,Sadece kitapların kapakları güzel...,0
1635,Galiba beklentimin fazla olmasından dolayı çok zevkle okuyamadım,0
1636,"Malesef abartıldığı kadar iyi gelmedi, belki de bana hitap etmiyordur.",0
1637,acıkcası pek hosuma gitmedi kitap küçük ama olay bastan itibaren karışık geldi okunmasada olur cok bişey kaybatmezsiniz,0
1638,Çok iyi bir psikolojik kitap olduğunun farkındayım ama sanırım benim için ilk olduğundan dolayı bana ağır geldi... Yani pek fazla kitaba odaklanamadım. Ama güzel bir anlatımı var yazarın,0
1639,Değişik bir kitap hoşuma gitmedi.,0
1640,"akıcı, sürükleyici ancak illa okunmalı diyeblieceğiniz bir kitap değil.",0
1641,"Hiç övüldüğü gibi değil, çok yavan bir konusu ve karmaşık bir olay akışı var.Övüldüğü kadar yokmuş tatmin olmadım.",0
1642,"merakla alıp okudugum, bu hıkayenın sonunda ılgınc bır sey cıkacak dıye bekledıgım kıtap :)) sonuc: sonunda ne oldu anlayamadımv:)",0
1643,Ben popülaritesi yüksek bir kitap diye aldım ama beğenemedim bana bir şeyler eklediğini düşünmüyorum okunmasada olurdu,0
1644,aslında güzel bir konu fakat anlatımı sıkıcı,0
1645,Beğenemedim. Okuyucuya hiç yorum payi birakmamiş.,0
1646,çevremden duyduğum öneriler üzerine okuduğum bir kitap fakat beklentilerimi karşılayamadı maalesef. ismi ve öneriler doğrultusunda daha etkileyici bir kitap beklerdim.,0
1647,Okunurken merak edilse de sonu tahmin edilemeyecek şekilde kolay bitiyor. Yazarın anlatımı okuyucuyu olması gerekenden fazla bir beklentiye soktuğu için bitişi basit bulabilirsiniz.,0
1648,"akıcı bir dili yok , konu bütünlüğü pek sağlanamamış.",0
1649,GUZEL BİR KİTAP YAŞAYIŞI ANLATAN BİR ADAMIN SIKINTILARINA RAMEN BAKIŞI VE OLUMLU KİBİRSİZ YAŞANTISI COK GUZEL BİR KİTAP HERKESE TAVSİYE EDERİM,0
1650,"Aslında çok kısa bir hikaye. Gereksiz ve abartılı metaforlarla, betimlemelerle kitap şişirilmiş. Bu kadar beğenilmesine şaşırdım.",0
1651,"Verdiği mesajlar açısından bakarsanız çok etkileyici bir kitap.
AMA çok sıkıcı ve yorucu bir kitap olduğunu da birçok kişi kabul edecektir.. Kendi görüşüm ile konuşursam kitabın ve olaylarin asıl can alıcı noktaları 150-160. sayfalardan sonra başlıyor iste böyle yorucu bir kitap.",0
1652,elif şafak'ı yıllar önce bu kitapla tanıdım daha önce nedense hep bir ön yargı vardı ama okuyunca kafamdaki o ön yargılar tamamen yok oldu çunku bir yazarı tanımak için enaz bir kitabını okumak gerektıgını düşünüyorum ..sonrasında zaten kitapların arkası geldi ..,0
1653,"Büyük bir beklentiyle alsam da -konusu her ne kadar anlamlı, acı gerçekler olsa da- yazarın üslubu gerçekten beni oldukça boğdu",0
1654,Kurgusu güzel ama karışık bir anlatımı var.,0
1655,"Belki ileride birşey olur, belki sonu güzel biter diyerek okudum ama umduğumu bulamadım. Yavandı diyebilirim. Okuduğum son Elif Şafak kitabı bir daha okuyacağımı sanmıyorum",0
1656,Konusu ilgi çekici olabilir ama anlatımı çok kötüydu.Zorla bitirebildigim bir kitapti.,0
1657,Yakışmamış bir kitap sonuç havada kalmış pek tavsiye etmem,0
1658,Sürükleyici bir kitap gelmedi bana . Çoğu kez bıraktım .,0
1659,begenmedim.adam cok itici bir hayat yasıyor.rahatsız oldum.önyargılı olsaydim satrancı okumazdım.daha guzel satranç kitabi.,0
1660,Sonu olmayan bir kitap olmuş. Anlatım oldukça yanlı. Farklı bakış açılarına kapı aralanmamış. Genel geçer kabulleri tekrarlamış. Bol bol da ünlü yazarlardan alıntı cabası.,0
1661,Resmen atlaya atlaya okudum. Bu kadar sıkıcı ve bunaltıcı bir kitap olamaz.,0
1662,Yazıldığ tarihe göre epey bir renkli ve kuvvetli hayal gücü gerektiren bir anlatım olmuş tavsiye edilir.,0
1663,"ilber hocanın tecrübelerinden faydalanmak isteyenler için bir kitap ona has üslubuyla sorular cevap verdiği bir söyleşi, yalnız İlber hoca bu ülkenin gerçeklerini bilmez gibi yorumları var, ülkemizde kendi ilini görmeyen binlerce öğrenci var, ayakkabıyı iki numara büyük alayımda 2 sene daha giysin denildi, herkes İlber hoca gibi şanlı doğmadı,",0
1664,Sabırla okunmalı sanıyorum okuyucu bağlamakta yetersiz olduğunu düşünüyorum felsefi bilgilerin diyaloglar aracılığıyla aktarması kopukluklara yol açmış,0
1665,"Popüler olmasının hakkını veriyor lakin bu hakkın olumlu bir manada olduğunu söyleyemeyeceğim. Çarpıcı kısımları, ufuk açıcı kısımları var elbette lakin bütün olarak bakıldığında teoloji kitaplarından çok da bir artısının olduğu söylenemez.",0
1666,Okumasaniz da birşey kaybetmezsiniz.,0
1667,serenad ve kardeşimin hikayesinden sonra büyük bir beklenti içinde alıp hayal kırıklığına uğradığım bir kitap.. iç içe geçmiş hikayeler.. sanki yazarın elinde bir çok hikaye varmış ve hepsini birden birleştirmiş gibi.. biraz üzerine yoğunlaşılsa hepsinden ayrı bir roman çıkacak kadar güzel hikayeler ama birden hepsini görünce çorba oluyor :),0
1668,bu konuda okunması gereken en son kitap diyebilirim,0
1669,"Yıllar önce okumaya çalıştım ama bitiremedim, yeniden okudum ama sanırım bana hitap etmedi, dilini beğenemedim.",0
1670,Franz Kafka gibi dev bir yazardan beklemediğim bir acemilik. Hayal kırıklığı oldu benim için.,0
1671,Hikaye etkileyeci ama dili akıcı değil. çeviriden kaynaklı bence sıkıntı var.bazı yerlerde ne demek istediğini anlayamıyorsunuz.,0
1672,"Yazarın İsrail kökenli olmasına rağmen, neden ısrarla Türkiye, müslümanlık üzerine yazdığını hırsla okudum. Aynı şeyleri tekrarlayarak yazmış. Kafa karıştırmaktan başka hiçbirşeye yaramıyor...",0
1673,"Kitapları yarım bırakmaktan pek hoşlanmam ama bu kitap yarım bıraktığım nadir kitaplardan. Olay örgüsü çok karışık geldi bana , olayların karışması bir yanda karakterlerde karışıyordu , kolombiyalı bir yazar ve isimlerde o şekilde olunca akılda kalması pek mümkün olmadı benim için.",0
1674,"Gerçekten çok sağlam bir anlatımı olan felsefik bir kitap. Yazar, kendi düşüncelerini ince ince ama çok sağlam bir şekilde işlemiş. Fakat maalesef bu kitabı tavsiye edemeyeceğim. Çünkü tevhid inancına tamamen ters fikirler öylesine çok yer alıyor ki kitapta bence normal bir okuyucu çoğu zaman bu fikirlerin farkına bile varamıyor. Farkına varılan yerlerde de yazar öyle mantıksal temeller üzerine oturtmuş ki cümlelerini, adeta okuyucuyu kendisine hayran bırakıyor. Tabi bu düşünceleri olumlu yöne çevirmek elbette mümkün ki ben bir çok yerde elimden geldiğince bunu yapmaya çalıştım. Eğer gerçekten dikkatli bir okuyucu değilseniz, salt edebi zevk için kitap okuyorsanız değil örtük düşüncelerin, kitabın bütünüyle kavranılacağından bile şüpheliyim. O yüzden çok da tavsiye edeceğim bir kitap değil.",0
1675,Roman ya da bir serüven okuyor gibi değil de felsefe ders kitabı okuyormuş gibi hissettim.,0
1676,Tarihçi ve batı hayranları okuyabilir ilgimi çekmeyen yerler vardı...,0
1677,"Pek sevemedim , bence zaman kaybı",0
1678,konu bakımından farklı bir kitap olmuş herkesin ilgisini çekecek türden değil,0
1679,"Çok hareketli bir olay Örgüsü olmayan bir kitaptı, okuduktan sonra isminin YouTube'daki ""Clickbait"" lere benzediğini düşündüm. Anafikir kitabın ismiyle alakalı değildi. Kitapsever bir insan olarak okunur tabi, fakat hikayesinin bir albenisi yok.",0
1680,Sarı Özek bozkırı iliklerinize kadar işliyor. Ancak kitabın sonlarına doğru sıkıcılaştı sürükleyici özelliğini yitirdi. Sonunun bir yere bağlandığını da düşünmüyorum :(,0
1681,Kitabı sırf bitirmek için bitirdim diyebilirim.Tabi bir emek var görmeden edemem bunu ama.Bir daha oku deseler en son seçeceğim kitaplardan biridir.Pek bir şey kattigini dusunmuyorum bir kaç düşünce sadece.,0
1682,İlber Ortaylı saniyelerini egitimle gecirmis biri desek yanlış olmaz... Ben onu Osmanli tarihini anlattığı kitaplarıyla sevdim... Bu kitabı da o yüzden aldım ama açikçası bir ömür nasil yaşanırdan ziyade şahsi görüslerle dolu bir kitap... Ve özellikle 15 yaşından sonra bir şey olunamayacağını (mesela ata bile binse insan duser ogrenemez diyor) söylemesi beni çok rahatsız etti... Sonuçta aksini ispatlayan bir sürü örnek var...,0
1683,Kitap üslup ve akıcılık olarak klasik Elif Şafak kitabı.Ama kitapta bir çok ama toplanıyor.En başta 300.sayfada en az 300 sayfa daha sürmeli diyor gibisini ama kitap bitiyor.yazar kitabın sonunda sıkılıp acele ile bitirmiş gibi.Bir diğer kötü yani ise erkek düşmanlığına varan feminizm.kitabin artı yönü ise önyargıyı bir tarafa koyup okuduğunuzda size kattığı biraz hoşgörü.,0
1684,kitaba başlamam ve bitirmem arasında yıl farkı oluştu zaten bu kitabı ya seviyorsunuz ya sevmiyorsunuz grisi olmayan bi kitap ben sevmeyenlerden oldum malesef,0
1685,"genel anlamda evrim teorisinin kesinliğini savunup bütün dinleri hatalı bulan (yer yer küçümseyen) bir temele dayanıyor kitap.
bölüm bölüm insanın serüvenini hoşa gidecek şekilde anlatmıyor değil. bir kesimin tamamen beğeneceği bir kesimin tamamen reddedeceği çok yer var. gördüğüm en iyi kitaplardan birisi değil maalesef.",0
1686,"Bu kitabın, Celâleddin Rumi'nin bir hikayesinin üzerine kurgulanmış olduğunu çoğu insan bilmez.",0
1687,Akıcı olmadıgı için sıkıcı gelebilir...,0
1688,Heyecanla okumayı beklediğim kitaptan yeterince haz alamadım. Aslında kitabın konusu çok güzeldi.fakat okumaya başladığım andan bitirene kadar beklediğin heyecanı bulamadım.,0
1689,tabi ki okunur ama bir ömür nasıl yaşanır? dan ziyade ilber hoca nasıl yaşamış onu okumuş oldum.,0
1690,john verdon un diğer kitapları daha srkleyici ve gerçekciydi. Bu kitapta açıklığa kavuşmayan bir sürü boşluk var kitap havada bitiyor. Beni tatmin etmedi açıkcası sırf bitirmiş olmak için okumaya devam ettim.,0
1691,Ticari amaçla yazılmış bir kitap. Tavsiyeleri her kesime hitap etmiyor. İlber hoca biraz halkın arasına karışsa imiş belki daha geniş kitleye hitap eden bir kitap olurmuş..,0
1692,"Sanki yazar, yazarken sıkılmış da ammaaan bitireyim derken sonunu yazmayı unutmuş gibi tuhaf diyebileceğim bir hikaye!",0
1693,ancak yarısına kadar okuyabildim daha öteye gitmiyor çok sıkıcı.Arada elime alıyorum bu sefer belki okurum diyorum ama 10 sayfadan daha ileriye gidemiyorum,0
1694,Sıradan bir kitap olmuş.,0
1695,"Okuduğuma pişman olduğum, baba hiçbirşey katmadığına emin olduğum kitap. Abartıldığı kadar yok.",0
1696,"yazım şeklinde gerçekten nefret ettim. her cümle de ""falan"" diye kestirip atan bir üslup bana göre değil malesef.",0
1697,"Evet akıcı sürükleyici bir roman ama, aman aman abartılacak kitap değil beni pek tatmin etmedi",0
1698,Büyük bir hayal kırıklığı oldu benim için. Akıcı bir kitap değildi kişi tasvirleri de yetersizdi.,0
1699,tam bir hayel kırıklığı... hiç beğennmedim. konular arasında kopukluk kitabı zor bitrmeme sebep oldu..,0
1700,klasiklerden denmiş çok güzel denmiş mutlaka okunmalı denmiş ama ben hiç beğenmedim. amerikan yazarlarının pek azını beğenirim. bu kitapta da amerikan sokak ağzı vardı. bu bir üslup mudur bilemiyorum. eğer öyle ise eksik olsun. bir jack london olmamış. çok kötü,0
1701,Çok sürükleyici bir kitaptı. Elif Şafak'tan beklenmeyecek bir sona sahipti yalnızca.,0
1702,Yorumlara bakarak beklentinizi yüksek tutmadığınız sürece pekala okunabilir. Fakat benim bu kitaptan beklentimi malesef karşılamadı.,0
1703,Tarihe çok fazla ilgim var ama nedense sıkıcı geldi bu kitap,0
1704,Fazla abartılmış iyi değil bilim kurguyla alakası yok,0
1705,"Evet çocuk kitabı bunu bilerek aldım, yorumlardan dolayı etkilenmistim ama hic okunasi değil doğrusul",0
1706,okunabilir ancak övüldüğü kadar bir kitap değildi. Beklentimin altında kaldı,0
1707,"Kitabı bitirdikten sonra ""şimdi bu kitap bana ne kattı?"" sorusuna cevap bulamadığım tek kitap. Sevmedim.",0
1708,"Elif Şafak'ın edebi kimliğini popülerliğe tercih ettiği romanıdır. Mümkün değildir Baba ve Piç, Araf, Pinhan gibi romanları yazan bir yazarın yayıncısını değiştirdikten sonra yazdığı romanları kabullenmek.",0
1709,fena değil bana göre,0
1710,"Aylak Adam romanından sonra okudum, yazarın anlatım tarzı gerçekten orijinal ama her iki kitapta da gereksiz ayrıntıda mühtehcenlikler açıkcası gereksiz ayrıntılı ve açıkcasi itici.",0
1711,"Bu kitap beklentimi karşılamadı. Olağanüstü bir durum yoktu. Duygu üzerine yazılmış bir kitap, olaya arıyorsanız olay yok. Diğer kitaplarını daha çok beğenmiştim.",0
1712,akılıcılığı güzel bir kitap fakat olay tasvirleri biraz detaysız bence daha iyi olabilirdi basit bir kurgu ile yazılmış...,0
1713,aradığımı bulabildiğimi pek söyleyemeyeceğim açıkçası. bitsin diye okudum pek tat alamadım.,0
1714,"Beğenmedim. Kesinlikle edebi bir değere sahip değil ve ana fikri olduğunu bile söyleyemem.
Bana hiçbir şey katmadı.",0
1715,Kitabın değerini anlayamayan nadir kişilerdenim sanırım.,0
1716,"Yorumlara bakarak alırsanız pişman olursunuz. Tamamen vakit kaybi,sıkıcı, kopuk bir kitap hicbir cekiciligi yok canımdan can koptu bitirirken.",0
1717,Lanet ettirircesine betimlemelerle dolu kitap. Overrated.,0
1718,Sevemedim ben ilgi çekici bir yanı yok.,0
1719,"Dili çok sade ve akıcıydı ancak hikayesi beni içine tam olarak çekemedi,beğenmedim",0
1720,Hayatımda okuduğum en sıkıcı kitaplardan biriydi. Belki devam etsem sarabilirdi ama yarısına gelmekte zorlandım ki kitap konusunda ısrarcıyımdır,0
1721,Anlatımı yorucu olmuş. Okurken zorlanabilirsiniz.,0
1722,argo ve sıradan bir üslubu var. heyecanla başladığım kitabı ilk sayfalarından itibaren soğuyarak bıraktım.,0
1723,Yazarın kitapları hep akıcı ama bu kitap diğerleri kadar olmasa da iyi sayılır.,0
1724,"Senden Önce Ben, kafanız doluyken, canınız sıkkınken hülasa moralmanınız sıfırken, biraz rahatlamak adına tercih edilebilecek, okuyucuyu yormayan best seller olmuş dandik kitaplardan biri. Hani bazı filmler için çerezlik denir ya, işte öyle çerezlik bir kitap.",0
1725,Orhan pamukun diğer kitapları gibi değil ama üzgünüm. Kendisinin kurgusu güzel fakat anlatımının zayıf olduğunu düşünüyorum,0
1726,"anlatımı,akıcılığı mükemmel sonu biraz hayal kırıklığına uğratsa da müthiş bir kitaptı.",0
1727,"Çok fazla betimleme var. Artık detay okumaktan sıkılıyorsunuz. Üzerine hikayenin tahmin edilebilir olması iyice can sıkıyor. Dört saatlik uçak yolculuğumda, tek seferde bitirdim. Daha önce dönüşüm ve satrançta bu kadar sıkılmamıştım. Aşırı betimleme sevmeyenler tekrar düşünsün..",0
1728,Sürekli kendini tekrar eden bir eser. Ayrıca anlatılan kişinin yaşadığı aşk değil saplantı aldığıma pişman olduğum bir kitap.,0
1729,Yeni kapak tasarımı niçin fiyatlarınızı da yeniledi keşke hiç yeni tasarım yapmasaydınız da fiyatlar aynı kalsaydı,0
1730,Felsefe meraklıları için birebir,0
1731,empati kitabını okuyup çok beğendiğim için almisdim ama kesinlikle beni tatmin etmedi kitaba kaç kere başladığımı bilemiyorum kesinlikle beni bağlayacak bir yani olmadı kendimi ne kadar zorlarsam zorlayayım kitabı bitiremedim,0
1732,"Siyahlara yapılan haksızlıkları anlatma bakımından 1960 yılına göre cesurca yazılmış olabilir ancak günümüz için sıradan kalıyor. Özellikle küçük bir kızın gözünden anlatılması ve çocukların günlük yaşamı üzerinde çok durması kitabı sıkıcı hale getirmiş. Alamut, bin muhteşem güneş, Semerkant, kürk mantolu madonna...vb kitaplarla kıyaslanamaz bence.",0
1733,Bana göre sınıfının en iyilerinden,0
1734,Kesinlikle heyecan uyandıran bir kitap değil. Pek birşey kattığınıda söyleyemem. Açıkçası vaktinizi boşa harcamış olursunuz tavsiye etmiyorum.,0
1735,Okurken sıkıldım sonlarına doğru daha iyiydi denilebilir.,0
1736,o kadar da abartıldığı gibi bi kitap değil ben hayal kırıklığına uğradım zaten siz de hayal kırıklığına uğramayın anlatımı çok sıkıcı betimlemelere fazlaca yer vermiş,0
1737,"O kadar da beğenmedim açıkçası, şişirilmiş bi kitap olduğunu düşünüyorum. Çok satanlar listesine aldanıp alınmamalı.",0
1738,çok etkileyici değil açıkçası..,0
1739,Sayfa sayısı az olduğu için çok satan bir kitap,0
1740,Büyük bir zevkle okuayacağımı düşünmüştüm. Sanırım Orhan Pamuk diye fazla beklenti içerisinde okuduğum için çok tatmin edici bulmamış olabilirim.,0
1741,Sosyal medyada hava atmak için veya plajda okumak için ideal bir kitap.,0
1742,beklentilerimi karşılamadı.bence klasik eser olmamalı,0
1743,"Bilmiyorum bana acayip sıkıcı geldi, belki ikinci defa okurum :(",0
1744,"Distopya seviyorsanız bir solukta okursunuz yada benim gibi azap çekersiniz. Liste bası oldugu için okumam gereken hissiyatıyla aldım, son sayfaya ne kadar kaldı hesaplamaktan bi hal oldum. O son sayfaya gelemeyenler de oldugu tesellisi içindeyim :)",0
1745,Ben de herkes gibi kitabın adına aldanıp kırsalda yaşayan çocukların hikayesi sananlardanım. tam tersine kitap tipik amerikan gençlerini anlatıyor. kötü bir kitap mı değil ama kesinlikle over-rated bir kitap olduğunu düşünüyorum. okurken kendimi sıradan bir amerikan gençlik filmi izliyormuş gibi hissettim.,0
1746,Açıkçası ben pek beğenemedim abartıldığı kadar iyi değildi.,0
1747,Çok sürüklemedi.Okumasam da olurdu,0
1748,Kitap psikolojik tahliller üzerine kurulu olmasından mütevellit bana pek hitap etmedi. Kısa bir kitap olmasa yarıda bırakabilirdim.,0
1749,İçerisinde argo kelimeler barındırın kurgusu olmayan eser,0
1750,"Psikolojik tahlilleri iyi verse de, bunaltan ve okuması güç bir kitap. Cümleler karmaşık, noktalama işaretleri yersiz. Düşünceler ve kurgu birbiri içinde. Sevemedim..",0
1751,Bence abartilan bir eser. Masalsi bir yani var ve beni pek etkilmeyei basaramadi acikcasi.,0
1752,Çok beğenmedim. Korku kitabı daha güzel.,0
1753,"İlk bölümü ilgiyle okudum fakat ikinci bölümde öyle çok sıkıldık ki bu durum yazarın başka bir kitabını okumama sebep oldu. Yazarın diğer kitaplarını bilmiyorum ama bu kitabın popüleritesi bir yana, en azından yazarı okumaya bu kitapla başlamaması gerektiğini düşünüyorum",0
1754,"""Biz onları ateşe çağıran öncüler kıldık."" Kasas 41",0
1755,"Beni çok etkilemedi ,zor bitirdim vakit kaybı geldi",0
1756,Açıkçası yapılan olumlu yorumlardan sonra okuduğum fakat hayal kırıklığına uğradığım bir kitap.Pazarlamanın gücü bir kez daha kendini gösteriyor..,0
1757,"Amerikalı 16 yaşında hala ergenlikten çıkamamış bir çocuğun bir kaç günlük anısı..
maalesef vakit kaybı.",0
1758,Arka kapak yazısı ve başlangıçtaki gazete alıntıları çok iddialı ancak çok da hakkını vermiyor.,0
1759,Diğer kitapları daha güzeldi. bitirmek için çok cabalasamda olmadı ve yarıda bıraktım.,0
1760,okunmaya değer bulamadım ve yarıda bıraktım. Neden mi ? İlgimi çekmedi ve edebi bir eser olarak göremedim. 1950'lerde yaşayan bir Amerikalı ergenin hayatından bir kesit.Bence daha değerli eserlere vakit ayırmalıyız.,0
1761,Kitabı teknik yönünden değerlendirmek istedim. KİTABIN YAZILARI ÇOK KÜÇÜK VE YAZI SİTİLİ KARIŞIK,0
1762,Öyküleri romanları kadar etkili değil,0
1763,Ders verip hayattan bir parça buldurmaya çalışan bir kitap ama kısa olmada bırakırdım elimden eminim,0
1764,Tamamlamadığım ender kitaplardan biri.,0
1765,George Orwellden beklenmeyecek kadar basıt ve anlamsız olay orgulerınde baglantı olmayan bır kıtap,0
1766,Yorumlara bakarak aldığım ama ne yazık ki hiç sevemediğim çok zor okuduğum bir kitap oldu . Bi ben beğenemedim sanırım,0
1767,"Arkadaş tavsiyesiyle alıp okuduğum, abartıldığını düşündüğüm bir kitap oldu kendileri. Arkadaşım hep abartır zaten...",0
1768,"Kitap hiç akıcı değil. Bir aşk romanı gözüyle okumam mümkün değildi ben de 70-80'ler İstanbul'unu tasvir ettiği yanıyla okumaya devam edebildim. Kemal'in aşkıyla ilgili tasvirleri fazlaca çocuksu geldi. O dünyaya bir türlü giremedim. 35+ yaşında bir adamın Kemal kadar saçma davranmasına tahammül etmekte zorlandım. 500 sayfa bir kitabı yazmak, karakterleri oluşturmak, psikolojik analizlerini yapıp okuyucuya yansıtmak mutlaka büyük bir başarıdır fakat bana hitap etmedi.",0
1769,Yavrularımızı eğitmek için nasıl bir yol izlenmesi gerektiği ve bu konuda anne-babalara destek olmayı amaçlayan bir eser.,0
1770,hasta olduğum bir zaman da okumamın da etkisiyle kötü etkilendiğim bir kitap,0
1771,Çok sıkıcı bulduğun nadir kitaplardan. Bir ergenin günlüğü diyebilirim kısaca. Bi de siz okuyun belki seversiniz.,0
1772,kitap beklentilerimi karşılamadı. anlatım şekli ve konu bütünlüğü açısından çok eksiklikleri olduğunu düşünüyorum. kitaba ilk sayfaları güzel başladı fakat daha sonraki sayfalar o kadar dağınık geldi ki kitabı elimden bırakmak zorunda kaldım. bence bu tarz kitaplarda orwell öncü niteliğinde.,0
1773,Anlatıldığı gibi bulmadım. Çocuklar için güzel bir kitap.,0
1774,"Stefan Zweig kitapları arasında okuması,ilerlemesi ve bitmesi en ağır kitap bu oldu sanırım.Zweig severim lakin bitmek bilmeyen bu kitabını sevemedim malesef.",0
1775,"ben de çok beğenemedim, ama yine de okunmalı.",0
1776,kitap hiç ilerlemiyor ve 1-2 cümlede anlatılabilecek bazı konuları yazar sayfalarca yazmış. Ayrıca Evrim Teorisini sağlam temellere oturtmadan varsayım üzerine hareket ediyor.,0
1777,Sayın Livaneli'nin Mutluluk ve Serenad ile yakaladığı ivmenin Kardeşimin Hikayesi ile biraz duraksadığını hissetmiştim. Bu kitabını isminden de kaynaklı olarak tarihi kurgu diye beklentiye girerek başladım ama (!) ivmenin tamamen durduğunu gördüm. Karakter analizleri ve hayatlardan yapılan alıntılarla başlanmış bitirilmiş. açıkçası hayal kırıklığına uğradım.,0
1778,kitap çok abartılıyor bence yazarın kalitesi dışında pek bir numarası yok açıkçası,0
1779,Mesnevide anlatılmış bir kıssanın değiştirip kitap haline getirilmiş versiyonu ben orjinalini tercih ederim.,0
1780,Ne iyi ne kötü..kitabin adından daha farklı bi konu bekliyordum. Aslında çevirisi güzel olmuş o kültürü bire bir yansıtmış ama yine de pen sevemedim,0
1781,yazarın diğer kitaplarından çoğunu okudum. bu onların yanında sönük kalmış. ama yinede okunabilir.,0
1782,Bence Orhan Pamuk değil de Ali Veli yazmış olsaydı kesinlikle baskısı bile yapılmazdı bu kitabın. Ben sevmedim açıkçası.,0
1783,"ilk 100 sayfasini zorla okuduğum, sonraki 50 sayfada akıcı olan bir kitap.anlatımı yalın olsada beni pek içine alamadı.(son sayfalar hariç)okumayan bişe kaybetmez diyerek sanırım ilk olumsuz eleştiriyi ben yapıyorum.bu yazarı pek beğenmedim açıkçası",0
1784,Abartildigi kadar güzel değildi...,0
1785,Çok güzel bir kitap kütüphanenizde mutlaka olsun.,0
1786,"Klasiklerde geçmesine rağmen güzel değil, konu derinliği yok ve anlatım dar kalıplara sıkışmış",0
1787,çok sıkıcı buldum bu kitabı. bence fazla abartılı şu popüler kitaplardan biri bu da.,0
1788,öykü çok da çekici değil hala bitirmeye çalışıyorum,0
1789,harika bir başyapıt gerçekten bayıldığım bir kitap oldu,0
1790,Stefan Zweıg'ın sıkılarak okuduğum bir eseriydi.Gereksiz ve yersiz betimlemeler çoktu. Tavsiye etmiyorum.,0
1791,Beklentimin oldukça altında kaldı.Zevk alamadım.,0
1792,"Kör Baykuş gerçekten çok ince bir kitap ama bu kadar az sayfaya bunca bunalımı ve karamsarlığı yazar nasıl sığdırmış insan hayret ediyor. Aslında okuduğumuz kitaplarda birtakım kötü alışkanlıklar ve karamsarlığın vurgulanmasını doğru bulmuyorum fakat sanatsal anlamda edebiyat ortamında kendine bir yer edindiği de bir gerçek. Biraz mesafeliyim, bu yüzden ihtiyatlı okuyacağım kitaplardan.",0
1793,Kitabın hikayesi beni pek tatmin etmedi. Genç bir çobanın kendi potansiyelini keşfetme sürecini anlatıyor. Bu kadar çok satılmasının nedeni popüler kültür etkisi.,0
1794,Ben de büyük bir beğeni uyandırmadı açıkçası. Okumasam da olurmuş.,0
