,review,label
3226,LİSE DÜZYİNDE OKUNMASI GEREKEN BİR KİTAP,1
3227,Pek beğenmedim. Tavsiye etmiyorum. Okumazsanız bir şey kaçırmazsınız diye düşünüyorum.,1
3228,Yazarın diğer kitapları kadar sarmadı beni. yine de okunulabilir.,1
3229,çok satanlarda görüp aldığım bir kitap bilim kurgu tarzım olmadığı için beğenmedim,1
3230,Her güne ayrı faaliyet..Ancak zamane çocukları için bir güne 5 faaliyet yeterli oluyor.,1
3231,"çok yavan kalmış bir kitaptı bence, bitince bu muydu yani dedim",1
3232,konuşkan bir arkadaşa sahip oluyoruz bu kitapla,1
3233,Marquezin en iyi kitabı mı değil ama okunabilir..,1
3234,"Kısacık oluşuna kanmamak gereken, sindirmesi zaman ve sabır isteyen gerçeküstü bir eser. Bozorg Alevî'nin Sâdık Hidâyet'i anlattığı sonsözünü okuyunca daha bir anlam kazanır bu arada, en azından benim gibi hikâyenin içine tam anlamıyla giremeyenler için.",1
3235,Okurken biraz sıkıldım ancak okunması gerekli bir eser. tavsiye ederim.,1
3236,içeriği güzel fakat bekledığımi bulamadım ama kıtaplıgınızda bulundurabılırsınız,1
3237,kitap benim çok ilgimi çekmedi ama farklı bir tarzda cinayet romanı okuyacaklar bu kitabı deneyebilir.,1
3238,Farklı ve özgün bir kitap. Çok severek okudum.,1
3239,bayağı gündemde bir kitaptı aldım okudum güzeldi heyecan vericiydi ama sonu beklediğimin altında bi sonuç verdi.,1
3240,Betimlemeler... İnsanların düşüncelerini anlatmakta usta olan bir yazar bütün kitapları okumaya değer.,1
3241,Abartılanın aksine beğenemediğim ve beni içine alamamış bir kitap. Okumasanız bir şey kaybetmezsiniz,1
3242,Başlarda çok ağır gitmesine rağmen kitap beni aldi goturdu.Bildiginiz bir yolda yürürken nasıl keyifl alabildiğinizi gösteren bir konu,1
3243,"Kimi kitapları okurken yorulursunuz ama elinizden de bırakmak istemezsiniz, öyle zor bir kitaptı.",1
3244,okurken gerçekten yaşadığım ve bu yüzden fazlaca gerildiğim bir kitap. sıkı bir hikayesi var. adaya düşen çocuklar hakkında.,1
3245,"1948’de yazılan ve 1984 olarak adı konan kitap, 194822den 1984’de yazarın gelecek insan hakkındaki hayallerinin kurgusu olup, zihnin kontrol altına alınıp insanların makineleştirilerek otoriter bir rejimle dünyanın idare edilmesi konu almaktadır. Günümüzde söylentileri ayyuka çıkan insan zihnini kontrol altına alma ve benzeri adımların iletişim çağı diye yutturulan tek tipleşen insanın acı serüveninin yarım asır önce yazılmış bir kurgu kitabı",1
3246,Yalnızlığın senfonisi ve acı ilk okumada pek kavrayamamış olsamda da güzel bir kitap,1
3247,Kitabı okurken bol argolu Amerikan filmi izlemiş gibi oluyorsunuz buna rağmen satır aralarındaki bazı incelikleri gözardı edemeyiz. Fena değil.,1
3248,puanımla alıp okuduğum güzel bir kitaptı,1
3249,bence kitap abartıldığı kadar veya arka kapakta yazan yorumlar kadar güzel değil. bilim kurgu romanlarında alışık olmadığımız bir senaryo vardı. okunabilir tavsiye ederim,1
3250,"Kitapların önemini, onlarsız bir dünyanın nasıl olacağını anlatan bir kitap. Yalnız olaylar ve durumlar bana karmaşık geldi. Akıcı değildi.",1
3251,beklediğim kadar değildi. Yine de güzel yazılmış..,1
3252,sıkılmadan okudum kurgu güzeldi.,1
3253,Sürükleyici bir olar ele alınmış. Sayfa sayfa merak uyandırıyor okurken.Biran önce son sayfaya ulaşmak istiyorsunuz.,1
3254,"Merak ettiğim kitaplardan biriydi. Oldukça akıcı bir dille yazılmış,kısa sürede okunup bitirilebilecek bir kitap. Ama bana basit geldi, belkide uzun süredir klasikleri okuduğum için böyle düşündüm.",1
3255,İnanın çok zor okudum. Üslubu biraz aykırı geldi. Argo yazıldığı için devam etsem mi atıp gitsem mi dedim ama bitirdim :)),1
3256,Beklentimin altında olduğunu söyleyebilirim. Konu olarak sıradışıydı fakat anlatımını çok yavan buldum. Anlatım bazı yerlerde olay örgüsünden kopuyordu ve bu da anlaşılmasını zorlaştırıyordu. Yine de kült bir eser olduğu için okunması gerekiyor. En azından Guy Montag kişisini tanımanız gerekiyor.,1
3257,Beklentimin altında kaldı. Gereksiz uzayan bölümler olduğunu düşünüyorum. Yine de okunması gereken bir eser.,1
3258,İlber Ortaylı’nın deneyimlerini görebileceğiniz bir kitap.,1
3259,Serinin 2. Kitabı. Ama kitap elimde olduğu için okudum. Çok bir şey beklememek lazım. Hayat devam ediyor.,1
3260,Aslında kitabın konusu güzel ancak kitapla ilgili beklentim çok yüksek olduğundan sanırım beklentimi çok karşılamadı.,1
3261,"Çok övüldü, büyük beklentilerle okudum ancak beğenemedim.",1
3262,"Akıcı, sonunu merak ettiğim bir kitap, ancak, din konusunda biraz yanlış söylemleri var sanki..",1
3263,Büyük bir bilim kurgu klasiği olarak övüldüğü için almıştım. Beklediğimi bulamadım bana fazlasıyla yavan geldi. 1984 veya Cesur Yeni Dünya tadını bulamıyorsunuz.,1
3264,"Güzel ama mutlaka kesinlikle okuyun diyemem , bildiğimiz şeyleri güzel ifade etmiş",1
3265,Etkisini asla kaybetmeyecek bir kitap. Çocuk kitabı gibi görünse de bu çok büyük bir yanılgıdır.,1
3266,"karşılıksız aşkın , vazgeçmemenin nasıl olduğunu iyi anlayacağınız bir eser.",1
3267,Stefan Zweig kitaplarını severim ama bu eseri beni içine çekemedi bir türlü,1
3268,Psikolojik eserler okumayı sevenler için ideal bu tarz eserler sevmiyorsanız okumakta zorlanabilirsiniz.,1
3269,Beğenmedim.Çok akıcı veya mesaj verici değildi.,1
3270,hıkaye guzel ama etkılenmek kısıye gore degısıyor.,1
3271,Çok büyük bir merakla okumaya başlamıştım aslında. Zamanla merak sarıyor ama akıcı ve alıp götürüyor diyemem. Sırf bitsin diye okudum yer yer.,1
3272,Bir kadının saf ve çıkarsız bir şekilde severek bıkmadan her seferinde o adamı farkedilmemesine ragmen bekleyerek gecirdiği sıradışı dramatik bir aşk hikayesi olmuş.,1
3273,Yazıldığı döneme göre başarılı bir eser elbette fakat modern öykü ve roman çizgisinde bakılınca elbette bu eserden daha başarılı öykü ve öykücülerimiz var. Bu denli rağbet görme sebebi belki de hacmi ve fiyatı olabilir diye düşünüyorum. Özellikle lise çağı gençlere tavsiye edilebilir.,1
3274,Çok iyi değil bitirmek için okudum,1
3275,Beyaz gemiyi nasıl severek okudaysam bu romanını da bitirebilmek için çaba harcadım..umduğumu bulamadım. .,1
3276,Bir türlü adapte olamıyordum. Öyle böyle bitirdim,1
3277,Vermek istediği mesaj çok güzel olsa da anlatım tarzı gerçekten çok yorucu. Başta kitabı okurken acaba çeviri hatası mı diye düşünüyordum sonra yazarın başka kitaplarını okuyan arkadaşlarım da zorlandığını belirtince yazarın anlatımı kaynaklı olduğunu düşünmeye başladım.,1
3278,"Tüm ön yargılarınızı ve bağlılıklarınızı bir kenara bırakıp kitaba öyle başlamanızı tavsiye ederim. Eğer din,ırk ve millet kategorileri sizin için birer tabuysa bu kitap sizi rahatsız edecek içeriğe sahip nitelikte.",1
3279,"Eski İstanbul'un, kırsal kesimden İstanbul'a gelenlerin hikayesi. Okurken bazı bölümlerde çok fazla karakter hikayesine ve detaya yer verildiği için sıkıldım. Kitapta yalnızca aşk yok, göç edenlerin hikayesini, toplumsal konuları da oldukça gerçekçi bir şekilde anlatıyor.",1
3280,Serinin Fi ve Çi den sonra beklentiyi çok yüksek tutmuştum beklediğim gibi olmadı ne yazık ki.Fakat genel olarak üçlemenin farkındalık yaratmada etkili olduğu gerçeği gözardı edilemez.,1
3281,Genelde çocuklara hitap ediyor fakat fantastik konusuyla ilgi çekiyor.,1
3282,küçüklerden cok büyükler icin mesajlar iceren bir kitap,1
3283,Biraz felsefi bir kitap. Sıkıldığım yerler olmadı değil yani...,1
3284,insanın kendini sorgulamasını ve iç çekişmelerini anlatan güzel bir Sabahattin Ali klasiği,1
3285,"Çok ince bir mesajı var, şahsen okurken sıkıldım çünkü o mesajı alamadım. Saksı olmanın faydaları isimli kitapla yan yana koyunca birleşti bir şeyler, o zaman anlam kazandı...",1
3286,"Salinger'i ilk defa bu kitabıyla tanıdım.Ağır bir tempoyla başlayan kitaba okudukça alışıyorsunuz.
Çok beğendiğimi söyleyemem; çünkü yazarın en iyi kitabı en biline kitabı olduğu üzere almıştım; kararı siz verin derim.",1
3287,kitabın bazı bölümleri hoşuma gitmese de yine de okunabilir muhteşem eserlerden bir tanesi,1
3288,"Merakla okuduğum bir kitap , akıcı ve çarpıcı...",1
3289,Cevirisini pek begenmedim.yine de konu itibatiyle guzel bir kitap,1
3290,bazı yerlerde sıkan ama genel olarak etkileyici bir kitap,1
3291,Fazla duygusal ama bir o kadar da güzel.,1
3292,Orhan Pamuk okuyamayan biri olarak tavsiye üzerine aldım. Yeni bir başlangıç yapmak için.,1
3293,"Sabahattin Ali’den İçimizdeki Şeytan ve Kürk Mantolu Madonna’yı okudum. İkisi de benim için tavsiye edildikleri kadar değildi. İkisi de akıcı, iyi hikayeler ama Markopaşa Yazıları’nı okuduğunuzda etkileneceğiniz kadat etkiler mi? Beni etkilemedi.",1
3294,güzeldi ama biraz yüzeysel kalmıştı sanki..,1
3295,Kitap sürükleyici ama yine de soru işaretleri bıraktı biterken.Marquez burada kör olmuş bir toplumu karşısına almış etkili bir kitap tavsiye ederim.,1
3296,Beklediğimin altında bir anlatımı vardı.,1
3297,kısa öykülerden oluşuyor bambaşka konularda. çok bayılmadım ama okunabilir,1
3298,Güzel bir roman ama beklentilerimi karşıladığını söyleyemeyeceğim..,1
3299,Kötü bir kitap değil ama neden bu kadar popüler anlayamadım,1
3300,Aşkı bambaşka anlatan bi kitap. .Romantik bir aşk kitabı denemez ama güzel duygularla okutuyor kendini. Tavsiye ederim kütaphanenizde bulunması gereken bi kitap.,1
3301,konusuna bakıp almıştım ama beklentimin altında bi kitap oldu,1
3302,"Uzun zamandır okunacaklar listemde olan bir kitaptı. Kitap sürükleyici bir kitap, oldukça dikkatli kurgulanmış ama benim beklentimi karşılamadı. Mevlana ve Şems'te galiba aradığımı bulamadım :(",1
3303,Bu kafar uzun soluklu serileri okumayı sevmem derdim bu seriyle fikrim değişti,1
3304,"Adaletsiz, kötü bir dünyada yaşayan, daha çok genç olan Alex ve arkadaşlarının hikayesi Otomatik Portakal. okumadan geçmeyin derim ben",1
3305,kitabı okurken insanın yaratılış itibariyle iyi mi yoksa kötü mü olduğunu bol bol sorgulayacağınızı ve birçok cümlesinde kendi hayatınızdan izler bulacağınızı düşünüyorum. Yazarın diğer kitapları konusunda her ne kadar bir fikrim olmasa da bu kitabına bir şans verilmeli.,1
3306,Nobel ödülünü görünce hemen aldım. Ben kendimi hiçbir zaman kitap eleştecek aşamada görmedim ama benim ilgimi çekemediğini söyleyebilirim sadece.,1
3307,ilber hocamızdan öğrenecek çok şeyimiz var.. Kitabı okuduktan sonra hayata bakış açım değişti..,1
3308,okurken seni kendi dünyasına çekiyor,1
3309,"herkese hitap etmeyebilir, kafaniz sakinken okumak daha iyi olur anlamaniz acisindan...",1
3310,konu bu kadar güzelken niye kitap beni içine çekemedi bilmiyorum. ama yazar bi türlü olayları başlatamadı. ben sıkıldım açıkçası,1
3311,Edebi yönü zayıf kurgusal yönü kuvvetli olan bir kitap...,1
3312,romanlarını daha çok sevsem de öyküleri de akıcı..,1
3313,Bilemiyorum biraz enteresan bi hikaye. Anlatım güzel gerçeklik hikayeye sokuyor sizi. Ama küt diye bitiyor hikaye. Sanki devamı varmış gibi ama yok.,1
3314,klasik bir aşk hikayesi ama akıcı hoş,1
3315,bazı yerlerinde bu lafı kim söylüyor şimdi diye ikileme düşsemde güzel bir kitap,1
3316,aşk çok ses getirince aldım okudum konu güzel ama sevemedim bu yazarı mevlana ve şems için okunur,1
3317,"Başlarda çok heyecan verdi gerçekten ilginç bilgiler yer alıyor,bazı noktalarda yazarın objektiflikten uzak kaldigini düşünüyorum.Yine de herkesin kütüphanesinde olması gerekenlerden.",1
3318,"Kitap kendi alanında kütüphanenizde bulundurulabilecek bir kitap,zaman kaybı olmayacağını düşünüyorum",1
3319,Beklediğim kadar iyi değildi ama okunabilir yine de..,1
3320,"Yunus Emren'nin hayatıyla ilgili bilgiler gerçek kaynaklarda da çok az bildiğim kadarıyla.Üstad bir kurgunun etrafında Yunus Emre'yi anlatmış.Naçizane,kitabın bazı bölümlerinin biraz fazla uzun tutulduğunu düşünüyorum.",1
3321,gerçekten etkileyici bir romandı,1
3322,sizi içine aliyor.,1
3323,basit bir macera kitabı gibime geldi esranrengiz yani şizofreni yönü,1
3324,bir zülfü livaneli klasiği..,1
3325,"Akıcı ve yormayan bir anlatımı var. Bu kitap ile ""Harese"" nin ne olduğunu öğrendim. Böylece ""Deveyi diken...."" sözü kafamda iyice netleşti. Aslında anlatılan konu güncel. Her türlü şiddete karşıyım dolayısyla Meleknaz a üzüldüm ama beni Hüseyin ve gazeteci arkadaşı kadar etkilemedi. Bu hikaye çok derinden sarsmadı açıkçası. Bir arkadaşım Serenadı şiddetle tavsiye etmişti. O kitabı okuayacağım",1
3326,Bilim Kurgu sevenlerin bayılacağı kitap. Ben oyumu 1984ten yana kullanıyorum :),1
3327,okurken bitirmekte zorlandığım bir kitaptı ama sonunda iyi ki okumuşum dedim,1
3328,okurken kitabın nasıl bittiğini anlamıyorsunuz.,1
3329,best seller olmak için bir sebep bulamadığım kitap. çok boş vaktiniz varsa da daha kültürel ya da size bir şeyler katan kitaplar okumanızı tavsiye ederim,1
3330,Eserde diktatörlük öyle bir resmedilmiş ki okuyucunun içini karartıyor. Orwell kahranmanlarıyla birlikte okuyanları da tedirgin etmeyi başarıyor,1
3331,farklı bir kitap çok tarzım olmasa da merak uyandırdı. ortalama diyebilirim,1
3332,Beklentilerimi karşılamadı ara ara sıkıldım. Sonu zatwn cok şaşırtmadı,1
3333,Güzel bir kitap olmasına rağmen ben aşırı abartıldığını düşünüyorum.,1
3334,Okurken yordu farkındalık tekrarları. İlk iki kitabı okurken özellikle Fi'yi okurken Grinin Elli Tonu'nun yansıması gibi geldi.,1
3335,Sürükleyici kabul ama o kadar bana çok şey kattı diyemem,1
3336,Masumiyet müzesi kadar etkileyiciliği olmasa da akıcı bir orhan pamuk klasiği,1
3337,kitaba yapılan yoğun övgü yüzünden aldım ama malesef beklentilerimi pek karşılamadı .,1
3338,Issız adada yaşam ve iktidar mücadelesi veren çocukların hikayesi.Okumaya değer bir roman.İsbankasi yayınları olması daha kıymetli kılıyor kitabı.,1
3339,çocuk kitabı ağır kitaplar okuyorsanız bu kitabı okurken sıkılabilirsiniz,1
3340,Başı çok sıkıyor. 2-3 kez denememe rağmen daha okuyamadım..,1
3341,Atatürkün hayatını değişik bir tarzda yazmış,1
3342,#gabrielgarciamarquez bu kitabında çocukluğunun geçtiği kasabada gerçekleşen bir namus cinayetini anlatmıştır. Kısa fakat yoğun bir kitap. Kitabın içeriğinde birçok isim geçtiğinden ve konu sürekli birilerinin ağzından anlatıldığı için sakin kafayla ve konsantre olunarak okunması gereken bir kitap ..,1
3343,İsmini daha öncede duymuştum ama keşke daha önce okusaydım,1
3344,livaneli'nin kalemini seiyorum okuduğum bir kaç kitabı var Huzursuzluk kitabında olaylar akıcı güzel çok güzel anlatımış ama kitabın sonu kesinlikle havada kaldı !,1
3345,merhaba ben 14 yaşındayım bu kitap bana ağır gelrmi öğretmenimiz tavsiye etti onun için okumak istyorum,1
3346,İlk 200 sayfası çok akıcı ne olacak diye düşünerek okuduğum fakat 200-350 arasında artık birşeyler olsun diye sıkılarak okuduğum kitap. Fakat sonu beni etkiledi bence okunabilir ben çok merak ettiğim için okumuştum,1
3347,Ilk Zweig okuyacaklar icin bu kitapla baslamak yanlış bir tercih olabilir.,1
3348,Oldukça karamsar ve kasvetli bir fonu ve hikayesi var. İçinde nefes almak zor.,1
3349,Beklentinin altında bi eser. Vermek istediği mesaj güzel olabilir ama belki kahramanın yüzeyselliği yüzünden insan derinde hissedemiyor ama kahramanın yaptıklarına şaşırıyor,1
3350,Kitap mini mini bölümlerden oluşuyor ama konu aynı şey üzerinde dönüyor. Beni çok sıktı. Sanırım bırakacağım.,1
3351,sohbet tarzı güzel tavsiyeler var.,1
3352,Farklı bir kitap türü. Herkesin okuması gerekir. Liderlik ve yönetim ile ilgili çok etkileyici.,1
3353,"açıkçası okurken çok sıkıldım,ilk başı ve sona doğru daha kolay okudum.belki ara ara okunması gereken bir kitap olabilir.",1
3354,Uzun zamandır okumak istediğim bir kitaptı. aradığım etkiyi tam anlamıyla bulduğum söylenemez.,1
3355,Dili sade ve anlaşılır. Okurken hüzünleniyorsunuz. Etkileyici buldum.,1
3356,Duygusal bir kitap.Konusu Yeşilçam filmlerini aratmıyor ama genç kızların okuyabileceği bir kitap.,1
3357,"Fena bir kitap değil. İçerisinde bir çok oyun var. En büyük eksiliği oyunların düzensiz olarak sıralanmış olması. En azından malzeme gerektiren ve gerektirmeyen, iki kişilik veya ikiden fazla kişiyle oynanacak oyunlar, çocukların en sevdikleri oyunlar veya yaş gruplarına göre oyunlar gibi alt başlıklar şeklinde gruplandırılmış olsa daha iyi olurdu.",1
3358,"Platonik aşk içerisindeki kadın karakterin duygularını net ve gerçekçi bir şekilde anlatan Zweig, daha çok ergenlik çağından kalma aşık olduğu adama bağımlı tutumunu yansıtmış. Yetişkin bir kadındansa, aşkını anlatırken hala o çocuksu duygu yoğunluğu ve bakış açısına şahit oluyoruz.",1
3359,"Hızlandırılmış ve sanki aceleye getirilmiş bir seri sonu kitabıydı, özellikle son bölümleri. Fi kitabındaki doyuruculuğu bu kitapta yoktu. Yine de seriyi tamamlamak ve boşlukları doldurmak açısından okunabilir.",1
3360,Akıcı bir eser. Olayın zamanla pişmesi çok etkileyici.,1
3361,güçlü ile güçsüzün mücadelesini çarpıcı bir şekilde işliyor,1
3362,Tat alamadığım bir kitap oldu ne yazık,1
3363,Nasıl bu kadar iyi kitaplar arasına alındığına inanamadığım tek kitap.İşlenişte gayet iyi ama kült kitaplar arasına girebilecek kadar olağanüstü bir kitap değil.,1
3364,İyi bir kitap ama çok da ilgimizi çekmedi açıkcası.,1
3365,"Bu tarz kitaplar sevmememe rağmen oldukça beğenmiştim, hatta filmi kitabından daha güzel diyebilirim",1
3366,orada öylece kendi ısısında eriyen bir balmumu kukla gibi oturuyordu...,1
3367,açıkçası beklentimi karşılamadı. bir çocuğun kendi ağzından anlatımıyla birkaç günü 'filan'.,1
3368,Okuması zorladı biraz ama güzeldi.,1
3369,Reklamı yapıldığı kadar üst düzey bir kitap değil. yine de okumaya değer keyifli okumalar..,1
3370,"Güzeldi, okunabilir",1
3371,Hayatın anlamını hiç olmadık şekile bulan bir kişinin hikayesi. Fena değil. Ortalara gelince abartıyor gibi gelmişti ama sonu güzel bağladı.,1
3372,Anlatmak istediğini masalımsı bir kurguyla vermiş. Zaman yaşamın kendisidir. Yaşamın yeri yürektir.,1
3373,Orhan Pamuk sevenlerin mutlaka okuması gerekir.,1
3374,Yazarın tarzı çok farklı,1
3375,beklentilerimin biraz altında kaldı ancak yine de kendinize tanıdık duygularla karşılaşabiliyorsunuz,1
3376,kitabı ilk sayfalarında sevdim çünkü çocugun okulu hakkındaki fikirleri benim okuluma bakış açımdı adeta. okunmaya değer,1
3377,Satış oranları veya beğenilere göre kitabı okuyacak olanlar hayal kırıklığına uğrayabilirler. Fakat kitabın vermek istediği mesaj ve dikkat çektiği noktalar gerçekten harika.,1
3378,En başlarda biraz sıkıcı gelse de sonradan sarıyor. Yazarın kitapta ilginç bir sokak ağzı kullanması kitabı eğlenceleri yapan unsurlardan bir tanesi. 2-3 günde bitirebileceğiniz akıcı bir kitap arıyorsanız okumak için ideal.,1
3379,Sonu beklediğim gibi bitmesede güzel kitaptı.,1
3380,"Yazardan okuduğum ilk kitap, kurgu biraz karışık olsa da konu akıcıydı",1
3381,Saatler içinde bitirilebilecek bir kitap. Kesin alın okuyun mutlaka bulunsun diyemem ama damağınızda tat bırakan kitaplardan,1
3382,mesaj güzel de anlatımı pek sevemedim,1
3383,"Puanım ropörtajı yapan yazara. İlber hoca kesinlikle çok kültürlü bilgili. Ondan gelecek her öneri bilgi çok değerli. Sorularla onu yakınmaya yönlendirmiş resmen. Yine de kitaptan ne aldım: gez gör hatta başka yerlerde yaşa, kültürel faaliyetlere katıl, dil öğren!",1
3384,"Hayatın koşturmaca içinde geçmesi ile unuttuğum, içimdeki çocuğun istediği şeyleri hatırlattı bana.",1
3385,"stefan""ın en iyi kitaplarından",1
3386,"aslında Orhan Pamuk kitapları bana hep ağır gelmiştir. ama kırmızı saçlı kadın çok akıcı bir kitap olmuş, bir çırpıda okudum.",1
3387,Bilimkurgu için oldukça temel bir eser sadece o dönemi bilmek kitabın kalitesini anlamakta önemli bir yere sahip.,1
3388,"soru cevap şeklinde yazılmış,aklımızdaki birçok soruya yanıt veren bir çalışma.tabiki taraf tutmadan yazılmış.",1
3389,Okuyunca mucizelere daha çok inanacaksınız.,1
3390,orhan pamuk un diğer kitaplarına göre daha sürükleyici bir kitap,1
3391,Herhalde ben beklentimi çok yüksek tuttum daha etkileyici bir şeyler bekliyordum ama güzel okunabilir.,1
3392,Çok detay var. Dolandırıp duruyor. Yazarın diğer kitaplarını da okudum gayet iyiler ama bu 70 sayfalık kitap bitmek bilmedi,1
3393,güzel değişik bi kitap okunabilir,1
3394,Kitap çok akıcı ve yol gösterici tavsiye ederim,1
3395,Çok büyük beklentilerle sipariş ettim. :),1
3396,diğer kitapları gıbı buda harikaydı zweig ile tanışmayan kalmamalı..,1
3397,"İlk başlarda sonucu öğrenip, sonradan detaylara girmek çok başarılıydı. Sadece isim karmaşası çok fazlaydı. Zaman zaman geri dönüp kim kimdi diye tekrar okuma ihtiyacı duydum.",1
3398,Akıcı bir kitap ama biraz fazla kısa gibi geldi.Hikayevari bir kitap diyebiliriz,1
3399,Okurken çok sıkıldım ben:( Sanırım distopya okumayı sevmedim ama konu çok etkileyici ve yaratıcı,1
3400,"güncel ve gençlere yönelik,güzel bir konusu olan ve sosyal mesajlı hoş bir roman.ancak ben edebi açıdan değerini göremedim.",1
3401,Yazarın eğitici kimliği çocukları çok iyi gözlemlemesini sağlamış.,1
3402,tarihimizi okumak gerek,1
3403,"Uzun zamandır almak istediğim bir kitaptı, derste hoca tavsiyesi üzerine direk aldım",1
3404,Benim için kitap anlatımını yoğunlaştıramadı ve maalesef çok uzun betimlemelerle akıcılığını kaybetti.,1
3405,Güzel incelemeler yer alıyor küçük prensin dünyasında.. Lakin kesinlikle çocuklar için olduğunu düşünmüyorum.,1
3406,kitabı çoksevdim sadece sonu eksik geldi,1
3407,Ahım şahım bir kitaptı herkese öneriyorum diyemiyeceğim bşr kitap ama kısa bir kitap olduğu için okumanızda fayda var. Farklı bir konu,1
3408,"İhsan Oktay Anar dan sonra elime aldığım bir kitap, o yüzden çok yavan geldi. Nobel ödülü almış bir yazar için bu performans üzücü. Zatn uzun süredir Orhan Pamuk kitaplarını neden elime almadığımı daha iyi hatırlattı bu kitap bana malesef.",1
3409,"Kendi alaninda basarili sayilabilir, ama bir olasiliksiz, empati yani Adam Fever kadar basarili degil. Diger kitaplarini okumadim bu yüzden, ama bir sans daha verip ikinci kitabini okumayi düsünüyorum. Sizi yormayan, cokda birsey katmayan, bir pazar gününü yada plajda okuyorum iste tadinda zaman gecirtecek bir kitap. Cok okunanlardan oldugu icin okumanizi, ufkuma acar diyorsaniz okumamanizi tavsiye ederim.",1
3410,Kalın bir kitabın ardından soluk almak için okunabilecek ortalama bir kitap.,1
3411,"Tüm çocukların okuması, çocukken okuyan ebeveynlerin ise tekrar okuması gereken bir kitap :)",1
3412,Her yaştan herkesin okuması gereken bir kitap.,1
3413,kopuk kopuk çok hoşuma gitmedi,1
3414,Dogrusunu soylemek gerekirse cok etkilenmedim ama okudugum icin pismam olmadim istanbulun bugunlere gelirkenki halinden kucuk bir resimdi,1
3415,Güzel mesajlar içeriyor,1
3416,"Biraz zor bir okuma sunan ancak olaylara dahil olduğunuzda oldukça keyif alabileceğiniz bir kitap. Oldukça benzersiz bir eser, farklı bir anlatım.",1
3417,bir kadının karşılık görmediğini bırak kendisini tanımayan bir adama hayatını adayacak kadar tutulması çok dramatik ve iç karartıcı. neyse ki kitap kısa ;),1
3418,güzel bir kitap almanızı tavsiye ederim etkileyici,1
3419,abartıldığı kadar beğenmedim. Günümüze hitap ettiğini düşünmüyorum,1
3420,iskender pala hayran olduğum bir yazar kitapları harika en çokta barbaros ü anlattığı efsane kitabı ; od da okunabilir güzel bir roman ama diğer romanları kadar da iyi değil gibi geldi bana,1
3421,Pek beğenemedim.Çok sönük bitti,1
3422,Konusundan çok kurulan harika cümleleri ile etkili. Kurgusu ise orta düzeyde bir kitap,1
3423,"Çok yavaş ilerleyen, arasına biraz bilimkurgu serpiştirilmiş sıkıcı bir bozkırda geçen bu roman beni pek tatmin etmedi. Yine de birşeylerin eksik kalmaması için Cengiz Han'a Küsen Bulut'u da okuyacağım. Kısacası herşeye rağmen kendisini okutturuyor.",1
3424,İlk okunuşta anlanılmayacak bir eser.,1
3425,"Bu tür distopik bilim-kurguların kölesi olduğum için zevkle okudum. Fakat okurken daha çarpıcı ve unutulmaz diyaloglar ve olaylar bekledim açıkcası. 1984 asla hafızamdan silinmeyecek sahneler taşırken, konusu daha iyi hatta daha spesifik olduğu için daha zor olan bu kitap 1984'ten daha geri kaldı benim için. Fakat benim gibi distopik bilim-kurgu seviyorsanız okumanızı tavsiye ederim.",1
3426,Konu güzel ama anlatım boğuyor.,1
3427,"Tatlı bir kitaptı, safi sevgiyi özleten. Edebi yönden çok beklentili olunmazsa, sevilebilecek bir kitap. Kapağına hayranım",1
3428,Güzel kitap. Akıcı bir dili var. Ancak birşeyler eksik gibi bir his uyandırdı bende.,1
3429,Doğrusu o kadar da beğenmedim.İlgimi çekmedi.Ama okumaktan zarar gelmez.Küçük bir çocuğun evrenine bir göz atın.,1
